{
  "before-path": "data/bunny.obj",
  "after-path": "data/bunny.obj",
  "method": "icp",
  "policy": "parallel",
  "translation": [ 1.0, 1.0, 1.0 ],
  "rotation": [
    0.3062,
    0.9186,
    0.2500,
    0.8839,
    0.1768,
    0.4330,
    0.3536,
    0.3536,
    0.8660
  ],
  "show-visualisation":  true
}
